date,username,to,replies,retweets,text,mentions,hashtags,permalink
23-02-2020 22.02,eoghandonne11y,,0,1, Dont know who is struggling to hold on more... Owen Farrell onto CJ Stander or Fine Geal on to power! #ENGvIRE #GE2020  ,,#ENGvIRE #GE2020,https://twitter.com/eoghandonne11y/status/1231700794006810631
23-02-2020 21.50,LeftistDad,,0,2, Last week: -SF arrange some public meetings in a hotel & a couple of pubs -FG call for martial law to quell the unrest Next week: -SPBP call anti FF/FG protest at the Dáil -FG demand internment of Paul Murphy for possession of a megaphone with intent to cause chanting #GE2020 ,,#GE2020,https://twitter.com/LeftistDad/status/1231697960351784965
23-02-2020 21.50,kevintoconnor,,0,3, One thing that been kind of forgotten in this left rising is that no matter what else happens #GE2020 got rid of one of the worst Taoiseachs we ever had. Good riddance. ,,#GE2020,https://twitter.com/kevintoconnor/status/1231697925597728768
23-02-2020 21.46,BigFlipper5,sinnfeinireland,0,0, Sorry Michelle but did you get elected in the recent #GE2020 ? ,,#GE2020,https://twitter.com/BigFlipper5/status/1231696933237989377
23-02-2020 21.42,serentrippety,,1,3, Politicians hold public clinics every week to meet individual voters & discuss their personal & local issues. Don’t see what the big deal is for Sinn Féin to meet groups of voters to discuss collective & national issues. #SinnFéin #GE2020 ,,#SinnF #GE2020,https://twitter.com/serentrippety/status/1231695919441174528
23-02-2020 21.42,seaseoche,,0,0," It's perfectly reasonable to question SF policies and question whether their commitments are achievable etc. It's also reasonable to ask ""what's the point in the rallies?"" but jesus lads, you're reaching when you're comparing them to the Nazis and Nuremberg rallies #GE2020 ",,#GE2020,https://twitter.com/seaseoche/status/1231695794379599872
23-02-2020 21.35,CDeaghadh,,4,27," So when it comes to @sinnfeinireland holding public meetings, @FineGael think it’s wrong ? Why has it been acceptable for them to hold public meetings... it’s almost as if they’re trying to push a narrative #Getoverit #SinnFein #GE2020  ", @sinnfeinireland  @FineGael,#Getoverit #SinnFein #GE2020,https://twitter.com/CDeaghadh/status/1231694168671621126
23-02-2020 21.28,AmandaFBelfast,,0,1, #GE2020 Twitter has *lost the run* of itself. Wise up would ye. ,,#GE2020,https://twitter.com/AmandaFBelfast/status/1231692346657529856
23-02-2020 21.22,of_playlist,,0,0, #GE2020 When the Business Association are demanding housing and public transport it’s a sign of how badly FF and FG have screwed up.  ,,#GE2020,https://twitter.com/of_playlist/status/1231690818676776960
23-02-2020 21.17,unspeakable28,DevlinMartina,0,0," It’s not long ago that water charges & property tax were the only game in town & no politician on the wrong side of the issue would survive, both issues were even mentioned in #ge2020 , sf will find that out ",,#ge2020,https://twitter.com/unspeakable28/status/1231689620183711744
23-02-2020 20.43,Bonn1eGreer,AWAyyad,6,2," Of course those polls show #BernieSanders ahead He's never stopped running for #POTUS, even when he left the Dems. Again. C'mon, people, This is for real! #GE2020  ",,#BernieSanders #POTUS #GE2020,https://twitter.com/Bonn1eGreer/status/1231681060594999301
23-02-2020 20.41,theamberdaisy,ShaunaKiely_,0,1," Tell me again about the national interest @LeoVaradkar @MichealMartinTD. Every child cherished, eh... #ge2020. You're fooling no one.  ", @LeoVaradkar  @MichealMartinTD,#ge2020,https://twitter.com/theamberdaisy/status/1231680478744317954
23-02-2020 20.41,Bonn1eGreer,ggreenwald,2,0," #BernieSanders won't win #Wisconsin. Trump has been there every other week for almost 4 years. He's pumped money into the state...why would they vote for #Bernie? C'mon, people. #GE2020  ",,#BernieSanders #Wisconsin #Bernie #GE2020,https://twitter.com/Bonn1eGreer/status/1231680402735161344
23-02-2020 20.16,TheOtherGordon,,0,0, This is what happens when you let people vote. #DWTSirl #GE2020 ,,#DWTSirl #GE2020,https://twitter.com/TheOtherGordon/status/1231674183983206400
23-02-2020 20.10,tauhenare,,4,1," Have my cake, And Eat it too. Vote #MaoriParty It’s what I’m doing this year at the #GE2020 ",,#MaoriParty #GE2020,https://twitter.com/tauhenare/status/1231672580035080193
23-02-2020 19.45,Eriu9,EOBroin,0,0," This is a matter of principle! People voted for change and that must be respected in a democracy! The powers that be have already tried to control the outcome by spreading fake news, democracy must overcome! @MaryLouMcDonald #Ge2020 ", @MaryLouMcDonald,#Ge2020,https://twitter.com/Eriu9/status/1231666368367464448
23-02-2020 19.38,LeftistDad,LeftistDad,0,0, Underrated tweet. #GE2020  ,,#GE2020,https://twitter.com/LeftistDad/status/1231664625424502788
23-02-2020 19.35,BealnamBlath,,0,0, Why 100 years between Sinn Fein's landslide 1918 election victory & its startling success of #GE2020 ? The Assassination of Michael Collins: What Happened at Béal na mBláth? http://goo.gl/a0tgOr #TimeforUnity #TimeforTruth ,,#GE2020 #TimeforUnity #TimeforTruth,https://twitter.com/BealnamBlath/status/1231663802711781376
23-02-2020 19.34,antooconnell,KimmyMonte,0,0, Sinn Fein and the IRA are not the same #Ge2020  ,,#Ge2020,https://twitter.com/antooconnell/status/1231663682964402176
23-02-2020 19.31,MaryERegan,MaryERegan,0,1, And of course the female voices of @rte @RTERadio1 that we were so brilliant throughout #GE2020 and beyond: @lawlor_aine @AudreyCarville @EnglishRachael @Mary___Wilson @MiriamOCal @Carolecoleman @KatieGHannon @ClaireByrneLive , @rte  @RTERadio1  @lawlor_aine  @AudreyCarville  @EnglishRachael  @Mary___Wilson  @MiriamOCal  @Carolecoleman  @KatieGHannon  @ClaireByrneLive,#GE2020,https://twitter.com/MaryERegan/status/1231662779003756553
23-02-2020 19.24,lmaoilir,,0,0, #SinnFein TDs build 1 million euro houses as far back as 18 years ago!! Thought they were on the average industrial wage? Certainly not living in social or rented housing!! #GE2020  ,,#SinnFein #GE2020,https://twitter.com/lmaoilir/status/1231661245218070528
23-02-2020 19.20,MaryERegan,KatieGHannon,1,0, Thanks @KatieGHannon If there was a Mary Party we’d have an overall majority! Happy to “Amplify 10 female voices and pass it on” For their #GE2020 coverage @KennyAKE @sharonmlynch @AilbheConneely @EdelMcAllister @SamanthaLibreri @Dyaneconnor @petulamartyn @TheMaggieDoyle .. , @KatieGHannon  @KennyAKE  @sharonmlynch  @AilbheConneely  @EdelMcAllister  @SamanthaLibreri  @Dyaneconnor  @petulamartyn  @TheMaggieDoyle,#GE2020,https://twitter.com/MaryERegan/status/1231660225385635840
23-02-2020 19.13,mir_ocall,,2,24," #FG went from exploiting #Auschwitz to keep their old power and political careers to the Peace Process. In the latter, they were joined by #FF and various cheerleaders. It's a political vulgarfest. Nothing now is beneath them. Can't watch it any more. #GE2020 ",,#FG #Auschwitz #FF #GE2020,https://twitter.com/mir_ocall/status/1231658385466167296
23-02-2020 19.13,MEneaney,Alan__Shatter,1,0," @Alan__Shatter Having attacked FG, FF and SF, what party or combination of parties do you see as displaying a moral compass suitable for Government? #GE2020 #33Dail ", @Alan__Shatter,#GE2020 #33Dail,https://twitter.com/MEneaney/status/1231658356630335488
23-02-2020 18.39,GaryMurphyDCU,,3,0, Our view of that Fernandes penalty for United at Old Trafford today. Not a bad old way to unwind after the mania of #GE2020 and its aftermath  ,,#GE2020,https://twitter.com/GaryMurphyDCU/status/1231649834538602496
23-02-2020 18.39,linny55,,0,0, #GE2020 A Senior Counsel tells the centre will hold. Fuck yeah. ,,#GE2020,https://twitter.com/linny55/status/1231649770046967808
23-02-2020 18.32,Argentocoxos,,0,1," Under FG, we had a situation in Waterford University Hospital where corpses were decomposing on trollies. #GE2020 #Ireland ",,#GE2020 #Ireland,https://twitter.com/Argentocoxos/status/1231647978735140866
23-02-2020 18.07,DeVore,,4,0, What exactly are these Sinn Fein protests exactly protesting?? #GE2020 ,,#GE2020,https://twitter.com/DeVore/status/1231641762621509633
23-02-2020 17.52,willsheehan68,caulmick,0,0," It is not a claim by Drew Harris, it is an intelligent assessment, based on the advice and information provided by Garda Special Branch. I believe Sinn Fein has a ‘board’ and I perhaps naively believe that ‘board’ is committed to politics. Can we all move on now. #GE2020  ",,#GE2020,https://twitter.com/willsheehan68/status/1231638026956218369
23-02-2020 17.50,LmkCountySocDem,Marklee78555990,1,0, Simply pointing to an independent source having already linked our policy and alternative budget for 20/20. We've recommended a constitutional amendment outlined in our manifesto for #GE2020. https://www.socialdemocrats.ie/InvestInBetter ,,#GE2020,https://twitter.com/LmkCountySocDem/status/1231637440596783104
23-02-2020 17.28,Dub_Snapper,,0,0," Was it strange how a former deputy chief constable of the PSNI was given the Garda Commissioner gig, last thing govt would want was more controversy given the previous occupier, did Govt actually envisage the rise in SF vote? if so then appointment makes perfect sense #ge2020 ",,#ge2020,https://twitter.com/Dub_Snapper/status/1231632013049901056
23-02-2020 17.20,thejournal_ie,,0,0," So, why don't we have a government yet, and how long could we be waiting? That's what @christinafinn8, @GaryMurphyDCU and @NickyRyan_ discuss on this week's @TheExplainerPod #GE2020  ", @christinafinn8  @GaryMurphyDCU  @NickyRyan_  @TheExplainerPod,#GE2020,https://twitter.com/thejournal_ie/status/1231629794401382405
23-02-2020 17.14,ashstronge,,0,1, Looks like it’s not just Irish politicians/commentators that are throwing around Nazi comparisons in order to fight against change #NevadaCaucus #GE2020  ,,#NevadaCaucus #GE2020,https://twitter.com/ashstronge/status/1231628385702612997
23-02-2020 17.03,amsickofit,EOBroin,0,0," #trumpism at it's best. #populism You got only 25% vote, deal with it civilly. Voters did their duty. Now do yours. Or is the army council intent in stirring up ""entitlement fever"" at these unnecessary rallies? Prove any supposed change by respecting #Democracy #GE2020 Mob rule ",,#trumpism #populism #Democracy #GE2020,https://twitter.com/amsickofit/status/1231625713389887488
23-02-2020 16.59,Dub_Snapper,,0,0," Its clear that the Irish voting public have taken a route the media aren't happy with, thats the problem with democracy, it tends to find a way through sooner or later #GE2020 ",,#GE2020,https://twitter.com/Dub_Snapper/status/1231624533301432320
23-02-2020 16.42,Elpenor_Dignam,IrishTimesPol,0,0, If the Greens go into coalition with FFG nobody will ever vote for them again. Climate Emergency ot not. #GE2020  ,,#GE2020,https://twitter.com/Elpenor_Dignam/status/1231620420039856135
23-02-2020 16.37,kealeybhoy,,1,0, FF and FG have a problem with a political party meeting with their electorate. Talk about being out of touch #GE2020 #SinnFein #sinnfeinsurge ,,#GE2020 #SinnFein #sinnfeinsurge,https://twitter.com/kealeybhoy/status/1231618982148440064
23-02-2020 16.33,Sarge1972,IrishTimes,0,0, But some wanted to celebrate them? @FineGael #GE2020 @LeoVaradkar , @FineGael  @LeoVaradkar,#GE2020,https://twitter.com/Sarge1972/status/1231618034512601095
23-02-2020 16.29,ismaithanfear,rtetwip,0,0, @sinnfeinireland got only 25% of the vote but are getting 75% of the Media Frenzy. @rtenews and @Independent_ie in particular #GE2020 was the first time in 47 years of voting that I voted SF and nothing I‘ve heard since the election would stop me voting for SF next time #twip , @sinnfeinireland  @rtenews  @Independent_ie,#GE2020 #twip,https://twitter.com/ismaithanfear/status/1231617204237545472
23-02-2020 16.28,ashstronge,,1,0, It’s also a bit concerning that a @FineGael TD sees talking to rallies and talking to each other in the Dáil as two mutually exclusive options #GE2020 , @FineGael,#GE2020,https://twitter.com/ashstronge/status/1231616864528236545
23-02-2020 16.19,TheHarryMcC,leeofthemail,0,1," I wonder if SF will mention that one of their TDs who enjoys posting anti-Semtic tweets, lives in a €1 million home she built without planning permission? I'm sure this aligns with their message of 'change'. #GE2020  ",,#GE2020,https://twitter.com/TheHarryMcC/status/1231614690347954178
23-02-2020 15.55,stejmurphy,,0,0, Fine Gael is literally the worst at losing. Their TDs and tweets are all over the shop and utterly whiney. #ge2020 We get it. You're moody. #finegael ,,#ge2020 #finegael,https://twitter.com/stejmurphy/status/1231608568438235137
23-02-2020 15.47,John_O_Connel1,leeofthemail,0,0," Don't like the media source of this information! But what is been overlooked it will take two main parties with support from a third(or Ind) to form a gov. Even if FF/FG agree to work with SF, will a third party support such an arrangement? #GE2020 & #GE20202 is coming!? ",,#GE2020 #GE20202,https://twitter.com/John_O_Connel1/status/1231606547718868992
23-02-2020 15.43,KealanFlynn,,0,0," Maybe but I do know this: I can say the wrong thing to Michéal Martin, or Leo Varadkar, or Eamon Ryan and I don’t have to worry about anyone paying a visit with an iron bar or a handgun to encourage a change of heart. That’s not so with Sinn Féin. #GE2020  ",,#GE2020,https://twitter.com/KealanFlynn/status/1231605546236678144
23-02-2020 15.39,CormacWalsh82,,0,0, As an Irish citizen living in Hamburg I couldn’t vote in the Irish #GE2020 a few weeks ago and today I don’t have a vote in the Hamburg state elections #HamburgWahl. 😕 I will apply for German citizenship but in the meantime its not so nice to be doubly disenfranchised. ,,#GE2020 #HamburgWahl,https://twitter.com/CormacWalsh82/status/1231604486122110976
23-02-2020 15.37,moneillsf,,28,81," Sinn Féin received an enormous mandate in #GE2020 535,595 people put their faith in Sinn Fèin - this cannot be ignored Sinn Féin will work to deliver a new style of politics & a government for change It is time to give workers & families a break. It is time for a new Ireland  ",,#GE2020,https://twitter.com/moneillsf/status/1231604000228659200
23-02-2020 15.32,TherealGerRyan,roisiningle,0,0, And that is why we had The Good Friday Agreement and why #lab are no longer wanted by the people. #ge2020 ,,#lab #ge2020,https://twitter.com/TherealGerRyan/status/1231602848355450883
23-02-2020 15.28,fusioniscoming,LucasOCorcora,0,0, It’s going to lead to trouble #Ge2020  ,,#Ge2020,https://twitter.com/fusioniscoming/status/1231601754334224390
23-02-2020 15.21,leeofthemail,,11,28, New Sinn Fein TD Built €1m House Without Planning Permission Author of controversial tweets sought help from FF Minister #ge2020  ,,#ge2020,https://twitter.com/leeofthemail/status/1231599984027586560
23-02-2020 15.20,AfricaWorldNews,,0,0," AfricaWorld News will be bringing you updates from the Liberty Hall as Sinn Fein rallies. #sinnfein #ireland #africaworldnews #GE2020 @Dublin, Ireland https://www.instagram.com/p/B86gkGFJgRv/?igshid=jz41xnxfxf3 ",,#sinnfein #ireland #africaworldnews #GE2020,https://twitter.com/AfricaWorldNews/status/1231599711985061888
23-02-2020 15.18,lmaoilir,YvonnecWhelan,1,0, #SinnFein record in West Belfast!! #Ge2020  ,,#SinnFein #Ge2020,https://twitter.com/lmaoilir/status/1231599321860186113
23-02-2020 15.18,leeofthemail,,3,1, Fine Gael and Fianna Fail party members block plans for quick Coalition https://extra.ie/2020/02/23/news/politics/fine-gael-fianna-fail-quick-coalition?utm_source=twitter&utm_medium=Social&utm_campaign=SocialWarfare via @ExtraIRL Leaderships of large parties confident of coup...but watch the Greens #Ge2020 , @ExtraIRL,#Ge2020,https://twitter.com/leeofthemail/status/1231599100648476672
23-02-2020 15.15,ZakiSamsudin,,1,0, Suggestion: Agong to urge for #GE2020; polling day within 21 days. Executive power placed temporarily under KSN. All contesting parties to accept results; winner allowed to govern uninterupted in the next 5 years; jumping parties to be outlawed. #Mahathir vs #AnwarIbrahim ,,#GE2020 #Mahathir #AnwarIbrahim,https://twitter.com/ZakiSamsudin/status/1231598422332825600
23-02-2020 15.15,OireachtasNews,,0,1, General Election 2020 - this #OireachtasLibrary infographic visually profiles the results of the 2020 general election of 8 February 2020. Click here for more information - #seeforyourself #GE2020 https://www.oireachtas.ie/en/how-parliament-is-run/houses-of-the-oireachtas-service/library-and-research-service/use-our-research/ ,,#OireachtasLibrary #seeforyourself #GE2020,https://twitter.com/OireachtasNews/status/1231598387629363201
23-02-2020 15.11,DipperMc,thatconorlad1,1,1, Can't think why @FineGael #Poshboys got a kicking in #GE2020? Out off touch! , @FineGael,#Poshboys #GE2020,https://twitter.com/DipperMc/status/1231597345072087040
23-02-2020 14.48,TinaMacVeigh,killianwoods,1,2, Ireland is the world's biggest tax haven. #BreakTheCycle #GE2020  ,,#BreakTheCycle #GE2020,https://twitter.com/TinaMacVeigh/status/1231591774260473856
23-02-2020 14.45,SaorAgusGaelach,SaorAgusGaelach,0,0," ""Your enemy's enemy is your friend"" Dissidents are the enemy of Sinn Féin. It suits Fianna Fáil and Fine Gael to believe dissident republicans. Dissidents say the army council runs Sinn Féin and how easy it is for these radicals to gain friends. #twip #GE2020  ",,#twip #GE2020,https://twitter.com/SaorAgusGaelach/status/1231590893666406400
23-02-2020 14.44,TinaMacVeigh,killianwoods,0,6, Manifestation of all thats wrong with profitled housing mkt thats in perpetual cycle of boom/bust. Until we break it. A left led government would immediately begin programme of #publichousing. Let the cheerleaders of the mkt dare to try to stop that! #BreakTheCycle #GE2020  ,,#publichousing #BreakTheCycle #GE2020,https://twitter.com/TinaMacVeigh/status/1231590734261870592
23-02-2020 14.41,moran_anto,,0,0, The Irish #GE2020 feels like it's gone on as long as brexit! ,,#GE2020,https://twitter.com/moran_anto/status/1231589970831446018
23-02-2020 14.27,NeotenuousApe,Mickcliff,2,0, These Shinner idiots just can't help themselves. Raise questions about bullying... they bully you. Well played lads. And the whataboutery that perpetuated the killings in the troubles is still their first port of call on any issue raised. Can't help themselves. #GE2020 ,,#GE2020,https://twitter.com/NeotenuousApe/status/1231586303990476803
23-02-2020 14.24,RayMinehane,,0,0, #GE2020 has taught me that people will ignore everything as long as you tell them what they want to hear. ,,#GE2020,https://twitter.com/RayMinehane/status/1231585699817820160
23-02-2020 14.15,cian2me,AnGobanSaor,0,0," True, but as we have a fantastic opportunity to enhance our indigenous sectors, it was a bit disappointing not too see initiatives being discussed in #GE2020. (By the way, no idea who the anon troll in the thread is!) ",,#GE2020,https://twitter.com/cian2me/status/1231583350869168128
23-02-2020 14.13,serentrippety,,7,23, “Portraying Sinn Féin as a dangerous party is a political strategy” says Michael O’Regan & he’s right. This is about keeping SF out of government at all costs & making a FF-FG-GP coalition more palatable to everyone who voted for change #SinnFein #GE2020  ,,#SinnFein #GE2020,https://twitter.com/serentrippety/status/1231582858487255042
23-02-2020 14.12,nomorequangos,Glenna_lynch,0,0, Very Interesting.... we're all becoming #Sinisterfringe..... btw I wonder did Drew Harris have a vote in #GE2020 ,,#Sinisterfringe #GE2020,https://twitter.com/nomorequangos/status/1231582704333991942
23-02-2020 14.11,LeftistDad,,0,1, What is Fine Gael's primary response when faced by politicised working class people? #twip #GE2020 #finegael ,,#twip #GE2020 #finegael,https://twitter.com/LeftistDad/status/1231582282579947521
23-02-2020 14.03,Culchie_Culture,Seanofthesouth,0,0, Need to get me a copy of that film... It's like he was campaigning in #ge2020 ,,#ge2020,https://twitter.com/Culchie_Culture/status/1231580373898989570
23-02-2020 13.57,fairysas,,0,0," Please watch ""Don't look back in anger 2010"" if you have forgotten what FF and Fg did to all normal working class people. I didn't get 20 loans and buy 4 houses I lived within my means. #GE2020 ",,#GE2020,https://twitter.com/fairysas/status/1231578823243763712
23-02-2020 13.55,DevlinMartina,downgerd,6,3, Rallies because the parties which came second and third in #GE2020 are refusing to even speak to SF to see if they can all find a way forward. ,,#GE2020,https://twitter.com/DevlinMartina/status/1231578368254054400
23-02-2020 13.45,Fintaann,HMcEntee,1,0, There's going to be a second election and FG/FF are going to lose power #GE2020  ,,#GE2020,https://twitter.com/Fintaann/status/1231575749892673539
23-02-2020 13.42,Glenna_lynch,,6,22, A welcome straight up piece of commentary from Michael O’Regan. Portraying Sinn Féin as a dangerous party is a political strategy #GE2020 https://www.irishtimes.com/news/politics/portraying-sinn-f%C3%A9in-as-a-dangerous-party-is-a-political-strategy-1.4182310 ,,#GE2020,https://twitter.com/Glenna_lynch/status/1231575047724204033
23-02-2020 13.39,linny55,danobrien20,1,0, Garda corruption - Liberal democratic values - mirror mirror. Do these clowns ever think about what they write. #GE2020 Job for Mick to investigate RUC/PSNI witholding evidence on Dublin/Monaghan bombings. ,,#GE2020,https://twitter.com/linny55/status/1231574372202295298
23-02-2020 13.31,Unionbuster,DaveDavemas,0,0, He may have now realised the #EU set him up #Ge2020 ,,#EU #Ge2020,https://twitter.com/Unionbuster/status/1231572343241265152
23-02-2020 13.31,cian2me,,2,0," Employment boom in #Dublin continues. Surprisingly, jobs did not feature as a key issue in #GE2020. Complacency?  ",,#Dublin #GE2020,https://twitter.com/cian2me/status/1231572336140308482
23-02-2020 13.26,ashstronge,GrantSana,2,0, Two things that has bothered me most about #Ge2020 across some politicians & commentators- the ‘oh no but the north is different’ argument when pushing politics of exclusion and the empty way they have thrown around past traumas solely to score political points.... ,,#Ge2020,https://twitter.com/ashstronge/status/1231571100930396161
23-02-2020 13.22,caulmick,,6,37," 'We engaged in a peace process 25 years, and while we have the peace we can't neglect the process' - @1GaryGannon #twip #GE2020  ", @1GaryGannon,#twip #GE2020,https://twitter.com/caulmick/status/1231569986013016064
23-02-2020 13.22,RebelTVIreland,,0,5, This #DrewHarris #ira #ireland #GE2020  ,,#DrewHarris #ira #ireland #GE2020,https://twitter.com/RebelTVIreland/status/1231569928781692931
23-02-2020 13.19,Sharrow_irl,Sharrow_irl,0,2," Did the Paper of Record hire John jonah Jameson, with a brief of, 'get me a picture of that Damned, Mary Lou, looking like, I dunno, The Grinch' #GE2020 #SFandSF ",,#GE2020 #SFandSF,https://twitter.com/Sharrow_irl/status/1231569317227061248
23-02-2020 13.12,rettiwt5463,,1,5," And as for the SF meeting or rallies... if u don’t want to go, don’t !! Know ones forcing anyone to attend 🙄🙄🙄 #dail #twip #ge2020 Nothing wrong with re-engaging with voting public !! It probably just disgusts FF/FG so much as u never hear from them again until next election ",,#dail #twip #ge2020,https://twitter.com/rettiwt5463/status/1231567480822337537
23-02-2020 13.07,rettiwt5463,,0,0, Can’t help but laugh at the hysterics of people on about Thurs voting in #dail. so what if ppl abstained... was never going to be a govt formed on first vote !! And who signs a contract without knowing what’s in it... was always going to be wait and see approach... #ge2020 #twip ,,#dail #ge2020 #twip,https://twitter.com/rettiwt5463/status/1231566352047013888
23-02-2020 13.01,TheHarryMcC,thejournal_ie,1,1," Let's play a game. Finish the sentence; 'Sinn Féin are holding public rallies to draw attention away from... - the SF TD who posted anti-Semtic tweets.' - from the PSNI, MI5, and Gardai reports that the IRA controll SF'. - from the SF TDs singing about the IRA.' #GE2020  ",,#GE2020,https://twitter.com/TheHarryMcC/status/1231564748937932805
23-02-2020 12.54,CrummeyE,,0,0, Sinn Fein spent the election campaign saying FF/FG were 2 sides of the same coin. SF got 24% of FPVs and combined FF/FG got 44% of the FPVs so maybe the majority of the electorate didn’t want SF based on numbers. I’m not aligned to any party just looking at numbers #GE2020 ,,#GE2020,https://twitter.com/CrummeyE/status/1231563013867614208
23-02-2020 12.53,TheHarryMcC,EOBroin,8,14, Sinn Féin received only 24.5% of the vote. The other parties do not want to form a government with them as their policies do not align. Now SF are rallying. Imagine if FG or FF rallied because they aren't getting there way? Laughable. #GE2020  ,,#GE2020,https://twitter.com/TheHarryMcC/status/1231562648891904001
23-02-2020 12.53,JoeRyanWex,RayMinehane,1,0, That's a matter for @socdems to reconcile. Having listened to the party espouse #slaintecare during the campaign I'd imagine they were keen to deliver on better healthcare after as well as before #GE2020 but that's just me! , @SocDems,#slaintecare #GE2020,https://twitter.com/JoeRyanWex/status/1231562624560779268
23-02-2020 12.53,HughGillanders,,0,0, If the make up of the negotiating teams of parties in the formation of Government is anything to go by then it doesnt augre well for the make up of cabinet - what is the reason that it's primarily men (there are notable exceptions) - @WeekendOnOneRTE #GE2020 , @WeekendOnOneRTE,#GE2020,https://twitter.com/HughGillanders/status/1231562624137154561
